module_name,vendor,device,cve_references,vulnerability_type,description,severity,category
linksys_eseries_themoon_rce,Linksys,"E-Series (E900, E1000, E1200, E1500, E1550, E2000, E2100L, E2500, E3000, E3200, E4200)",CVE-2014-2321,Remote Code Execution,Linksys E-Series TheMoon worm RCE vulnerability actively used by TheMoon malware,CRITICAL,router_exploit
netgear_r7000_r6400_rce,Netgear,R7000/R6400 (AC1750),CVE-2016-6277,Remote Code Execution,Netgear R7000 and R6400 remote command execution vulnerability,CRITICAL,router_exploit
cisco_ios_http_authorization_bypass,Cisco,IOS 11.3-12.2,CVE-2001-0537,Authentication Bypass,Cisco IOS HTTP server authentication bypass allowing admin access,HIGH,router_exploit
zte_zxv10_rce,ZTE,ZXV10 H108L,CVE-2014-2321,Remote Code Execution,ZTE ZXV10 H108L remote code execution vulnerability,CRITICAL,router_exploit
zte_zxhn_h108n_wifi_password_disclosure,ZTE,ZXHN H108N,CVE-2017-7276,Information Disclosure,ZTE ZXHN H108N WiFi password disclosure vulnerability,MEDIUM,router_exploit
huawei_hg532_rce,Huawei,HG532,CVE-2017-17215,Remote Code Execution,Huawei HG532 series routers remote code execution vulnerability,CRITICAL,router_exploit
mikrotik_routeros_jailbreak,MikroTik,RouterOS,CVE-2018-14847,Remote Code Execution,MikroTik RouterOS jailbreak vulnerability allowing arbitrary code execution,CRITICAL,router_exploit
technicolor_tc7200_password_disclosure,Technicolor,TC7200,CVE-2014-2321,Information Disclosure,Technicolor TC7200 password disclosure vulnerability,HIGH,router_exploit
technicolor_tc7200_password_disclosure_v2,Technicolor,TC7200,CVE-2016-10401,Information Disclosure,Technicolor TC7200 password disclosure v2 vulnerability,HIGH,router_exploit
zyxel_d1000_rce,ZyXEL,EIR D1000,CVE-2016-10401,Remote Code Execution,ZyXEL/Eir D1000 SOAP remote code execution vulnerability,CRITICAL,router_exploit
zyxel_d1000_wifi_password_disclosure,ZyXEL,EIR D1000,CVE-2016-10401,Information Disclosure,ZyXEL Eir D1000 WiFi password disclosure via TR-069,MEDIUM,router_exploit
zyxel_zywall_usg_extract_hashes,ZyXEL,ZyWALL USG (20/20W/50/100/200/300/1000/1050/2000),CVE-2012-3009,Authentication Bypass,ZyXEL ZyWALL USG authentication bypass in configuration import/export,HIGH,router_exploit
3com_officeconnect_rce,3Com,OfficeConnect,CVE-2003-0107,Remote Code Execution,3Com OfficeConnect router command injection vulnerability,HIGH,router_exploit
2wire_gateway_auth_bypass,2Wire,"Gateway (2701HGV-W, 3800HGV-B, 3801HGV)",CVE-2007-4387,Authentication Bypass,2Wire Gateway authentication bypass vulnerability,HIGH,router_exploit
asmax_ar1004g_password_disclosure,Asmax,AR 1004g,CVE-2008-5660,Information Disclosure,Asmax AR1004G password disclosure vulnerability,HIGH,router_exploit
belkin_g_plus_info_disclosure,Belkin,Wireless G Plus MIMO Router F5D9230-4,CVE-2008-0403,Information Disclosure,Belkin G Plus MIMO router information disclosure vulnerability,MEDIUM,router_exploit
billion_5200w_rce,Billion,5200W-T,CVE-2016-10176,Remote Code Execution,Billion 5200W-T router remote code execution vulnerability,CRITICAL,router_exploit
bhu_urouter_rce,BHU,uRouter,CVE-2016-10165,Remote Code Execution,BHU uRouter unauthenticated remote code execution vulnerability,CRITICAL,router_exploit
ipfire_proxy_rce,IPFire,IPFire < 2.19 Core Update 101,CVE-2016-5699,Remote Code Execution,IPFire proxy configuration remote code execution vulnerability,CRITICAL,router_exploit
ipfire_oinkcode_rce,IPFire,IPFire Firewall,CVE-2019-17653,Remote Code Execution,IPFire oinkcode parameter remote code execution vulnerability,CRITICAL,router_exploit
netsys_multi_rce,Netsys,Multiple Router Models,CVE-2019-6441,Remote Code Execution,Netsys routers multiple remote code execution vulnerabilities,CRITICAL,router_exploit
rompager_rom0_auth_bypass,Multiple,"RomPager Devices (D-Link, TP-Link, Huawei, ZTE, ZyXEL)",CVE-2014-4019,Authentication Bypass,RomPager ROM-0 authentication bypass vulnerability affecting 80+ models,HIGH,router_exploit
misfortune_cookie_rce,Multiple,RomPager Devices (80+ affected models),CVE-2014-9222,Remote Code Execution,Misfortune Cookie RomPager buffer overflow vulnerability,CRITICAL,router_exploit
p2p_wificam_rce,Multiple,P2P WiFi Cameras (1000+ device types),CVE-2017-8225,Remote Code Execution,P2P WiFi cameras GoAhead server remote code execution vulnerability,CRITICAL,camera_exploit
p2p_wificam_credential_disclosure,Multiple,P2P WiFi Cameras (1000+ device types),CVE-2017-8224,Information Disclosure,P2P WiFi cameras credential disclosure vulnerability,HIGH,camera_exploit
cctv_dvr_rce,Multiple,CCTV/DVR (70+ vendors),CVE-2016-10401,Remote Code Execution,Multiple CCTV-DVR vendors remote code execution vulnerability,CRITICAL,camera_exploit
dvr_creds_disclosure,Multiple,"DVR Devices (TBK, Novo, QSee, Pulnix, Securus, Night OWL)",CVE-2018-9995,Authentication Bypass,DVR devices credential disclosure vulnerability,HIGH,camera_exploit
netwave_ip_camera_info_disclosure,Netwave,IP Cameras,CVE-2017-8225,Information Disclosure,Netwave IP camera information disclosure vulnerability,HIGH,camera_exploit
dlink_dcs_930l_932l_auth_bypass,D-Link,DCS-930L/932L,CVE-2012-1215,Authentication Bypass,D-Link DCS cameras authentication bypass vulnerability,HIGH,camera_exploit
brickcom_corp_network_cameras_conf_disclosure,Brickcom,"Network Cameras (FB-100Ae, WCB-100Ap)",CVE-2016-5675,Information Disclosure,Brickcom Corporation network camera configuration disclosure,HIGH,camera_exploit
brickcom_users_cgi_creds_disclosure,Brickcom,"Cameras (WCB-040Af, WCB-100A, WCB-100Ae)",CVE-2017-3221,Information Disclosure,Brickcom camera credentials disclosure via users.cgi,HIGH,camera_exploit
avigilon_videoiq_camera_path_traversal,Avigilon,VideoIQ Camera,CVE-2016-5644,Path Traversal,Avigilon VideoIQ camera path traversal vulnerability,MEDIUM,camera_exploit
xiongmai_uc_httpd_path_traversal,XiongMai,UC-HTTPd Cameras,CVE-2017-7577,Path Traversal,XiongMai UC-HTTPd path traversal vulnerability,MEDIUM,camera_exploit
geutebruck_efd_2250_rce,Geutebruck,G-Cam/EFD-2250,CVE-2018-7520,Remote Code Execution,Geutebruck G-Cam/EFD-2250 RCE vulnerability via simple_loglistjs.cgi,CRITICAL,camera_exploit
beward_n100_rce,Beward,N100 H.264,CVE-2021-26708,Remote Code Execution,Beward N100 H.264 camera remote code execution vulnerability,CRITICAL,camera_exploit
acti_acm_5611_rce,ACTi,ACM-5611,CVE-2019-12547,Remote Code Execution,ACTi ACM-5611 video camera remote code execution,CRITICAL,camera_exploit
generic_ssh_auth_keys,Multiple,"SSH Devices with Exposed Keys (Quantum DXi, Array Networks, Baracuda, Ceragon, F5 BigIP, ExaGrid)",CVE-2015-6358,Authentication Bypass,Generic SSH private key exposure vulnerability affecting multiple vendors,CRITICAL,generic_exploit
